[
  {
    "measurement_id": "MEAS-SYNTH-001",
    "organism_id": "ORG-SYNTH-001",
    "dataset_id": "DS-SYNTH-PILOT-001",
    "trait_id": "AGD_AS",
    "value": 15.1,
    "unit": "mm",
    "landmark_start": "anal verge",
    "landmark_end": "posterior scrotal base",
    "method": "caliper",
    "instrument_id": "INSTMT-CALIPER-DEMO-001",
    "observer_id": "synthetic-observer",
    "date_or_stage": "adult day 90",
    "uncertainty": { "type": "not_applicable", "value": "NA_NOT_APPLICABLE", "unit": "NA_NOT_APPLICABLE" },
    "quality_flag": "A",
    "source": "Developmental Manifold Atlas synthetic pilot dataset v0.1",
    "access_tier": "tier_0_synthetic",
    "provenance": {
      "source_paper": "synthetic",
      "dataset_version": "0.1.0",
      "extraction_method": "generated synthetic fixture",
      "extractor": "dmatlas scaffold",
      "date_extracted": "2026-06-13",
      "original_unit": "mm",
      "transformation_applied": "none",
      "confidence_level": "high"
    },
    "notes": "No naked AGD value: landmarks, unit, method, context, and provenance are included."
  },
  {
    "measurement_id": "MEAS-SYNTH-002",
    "organism_id": "ORG-SYNTH-001",
    "dataset_id": "DS-SYNTH-PILOT-001",
    "trait_id": "SNOUT_SKULL_RATIO",
    "value": 0.349138,
    "unit": "ratio",
    "landmark_start": "nasion species-equivalent",
    "landmark_end": "rostral tip divided by skull length",
    "method": "manual",
    "instrument_id": "INSTMT-CALIPER-DEMO-001",
    "observer_id": "synthetic-observer",
    "date_or_stage": "adult day 90",
    "uncertainty": { "type": "not_applicable", "value": "NA_NOT_APPLICABLE", "unit": "NA_NOT_APPLICABLE" },
    "quality_flag": "B",
    "source": "Developmental Manifold Atlas synthetic pilot dataset v0.1",
    "access_tier": "tier_0_synthetic",
    "provenance": {
      "source_paper": "synthetic",
      "dataset_version": "0.1.0",
      "extraction_method": "derived from synthetic skull and snout lengths",
      "extractor": "dmatlas scaffold",
      "date_extracted": "2026-06-13",
      "original_unit": "mm/mm",
      "transformation_applied": "snout_length_mm / skull_length_mm",
      "confidence_level": "high"
    },
    "notes": "Derived value preserves its transformation."
  },
  {
    "measurement_id": "MEAS-SYNTH-003",
    "organism_id": "ORG-SYNTH-002",
    "dataset_id": "DS-SYNTH-PILOT-001",
    "trait_id": "AGD_AC",
    "value": 8.4,
    "unit": "mm",
    "landmark_start": "anal verge",
    "landmark_end": "clitoris",
    "method": "caliper",
    "instrument_id": "INSTMT-CALIPER-DEMO-001",
    "observer_id": "synthetic-observer",
    "date_or_stage": "adult day 90",
    "uncertainty": { "type": "not_applicable", "value": "NA_NOT_APPLICABLE", "unit": "NA_NOT_APPLICABLE" },
    "quality_flag": "A",
    "source": "Developmental Manifold Atlas synthetic pilot dataset v0.1",
    "access_tier": "tier_0_synthetic",
    "provenance": {
      "source_paper": "synthetic",
      "dataset_version": "0.1.0",
      "extraction_method": "generated synthetic fixture",
      "extractor": "dmatlas scaffold",
      "date_extracted": "2026-06-13",
      "original_unit": "mm",
      "transformation_applied": "none",
      "confidence_level": "high"
    },
    "notes": "Female AGD trait uses sex-specific landmark vocabulary."
  },
  {
    "measurement_id": "MEAS-SYNTH-004",
    "organism_id": "ORG-SYNTH-003",
    "dataset_id": "DS-SYNTH-PILOT-001",
    "trait_id": "HEAD_CIRCUMFERENCE",
    "value": 346.0,
    "unit": "mm",
    "landmark_start": "occipital point",
    "landmark_end": "frontal point circumference",
    "method": "aggregate_report",
    "instrument_id": "INSTMT-CALIPER-DEMO-001",
    "observer_id": "synthetic-aggregate",
    "date_or_stage": "39 gestational weeks",
    "uncertainty": { "type": "not_reported", "value": "NA_NOT_REPORTED", "unit": "NA_NOT_REPORTED" },
    "quality_flag": "C",
    "source": "Developmental Manifold Atlas synthetic pilot dataset v0.1",
    "access_tier": "tier_0_synthetic",
    "provenance": {
      "source_paper": "synthetic",
      "dataset_version": "0.1.0",
      "extraction_method": "generated synthetic aggregate",
      "extractor": "dmatlas scaffold",
      "date_extracted": "2026-06-13",
      "original_unit": "mm",
      "transformation_applied": "aggregate mean",
      "confidence_level": "medium"
    },
    "notes": "Synthetic neonatal aggregate, not an individual human clinical record."
  }
]

